{
  "name": "modeldev-toolkit",
  "version": "1.7.0",
  "description": "ModelDev Toolkit (MDT) for Claude Code: a Node-only toolkit of agents, skills, hooks, commands, and rules for stable software workflows",
  "author": {
    "name": "flatrick",
    "url": "https://github.com/flatrick"
  },
  "homepage": "https://github.com/flatrick/modeldev-toolkit",
  "repository": "https://github.com/flatrick/modeldev-toolkit",
  "license": "MIT",
  "keywords": [
    "claude-code",
    "agents",
    "skills",
    "hooks",
    "rules",
    "tdd",
    "code-review",
    "security",
    "workflow",
    "automation",
    "best-practices"
  ]
}
